{
  "format": "dsh-stack",
  "formatVersion": 1,
  "name": "Reproducible Web Profile",
  "description": "A minimal DeepSeek Harness web profile with dsh-stack installed for capture, inspection, and safe reproduction.",
  "createdAt": "2026-08-15T00:00:00.000Z",
  "source": {
    "profile": "web",
    "harnessVersion": "0.1.0-rc.6"
  },
  "bundles": [
    {
      "name": "@deepseek-ai/dsh-base",
      "sourceKind": "builtin"
    },
    {
      "name": "@deepseek-ai/dsh-web-app",
      "sourceKind": "builtin"
    },
    {
      "name": "dsh-stack",
      "specifier": "0.1.0",
      "installedVersion": "0.1.0",
      "sourceKind": "registry"
    }
  ],
  "profilePatch": {
    "content": "[]\n",
    "sha256": "sha256-37517e5f3dc66819f61f5a7bb8ace1921282415f10551d2defa5c3eb0985b570",
    "secrets": []
  },
  "warnings": [],
  "integrity": "sha256-6546a7770dcb1eeabce8fd0a031780bd981cacce95c7c1c4a90128350bc0f00e"
}
